,paper,year,month,title,author,code,prog
2448,2452,1987,December,"Quality Upgrading and its Welfare Cost in U.S. Steel Imports, 1969-74","['Randi Boorstein', 'Robert C Feenstra']",w02452,"['International Trade and Investment', 'International Finance and Macroeconomics']"
2449,2453,1987,December,Symmetric Pass-Through of Tariffs and Exchange Rates Under Imperfect Competition: An Empirical Test,['Robert C Feenstra'],w02453,"['International Trade and Investment', 'International Finance and Macroeconomics']"
2450,2454,1987,December,Wage Gaps vs. Output Gaps: Is There a Common Story for All of Europe?,['Robert J Gordon'],w02454,"['Economic Fluctuations and Growth', 'International Trade and Investment', 'International Finance and Macroeconomics']"
2451,2455,1987,December,U.S. Commercial Banks and the Developing Country Debt Crisis,"['Harry Huizinga', 'Jeffrey D Sachs']",w02455,"['International Trade and Investment', 'International Finance and Macroeconomics']"
2452,2456,1987,December,Means of Payment in Takeovers: Results for the U.K. and U.S.,"['Colin Mayer', 'Julian Franks', 'Robert S Harris']",w02456,['Monetary Economics']
2453,2457,1987,December,"Patents, Citations and Innovations: Tracing the Links",['Manuel Trajtenberg'],w02457,"['Productivity, Innovation, and Entrepreneurship']"
2454,2458,1987,December,Information and Multi-Period Optimal Income Taxation with Government Commitment,"['Dagobert L Brito', 'Jonathan H Hamilton', 'Joseph E Stiglitz', 'Steven M Slutsky']",w02458,['Public Economics']
2455,2459,1987,December,Trigger Strategies and Price Dynamics in Equity and Foreign Exchange Markets,['Paul R Krugman'],w02459,"['International Trade and Investment', 'International Finance and Macroeconomics']"
2456,2460,1987,December,International Capital Mobility and Tax Evasion,['Alberto Giovannini'],w02460,"['International Trade and Investment', 'International Finance and Macroeconomics']"
2457,2461,1987,December,Some Notes on the Scientific Methods of Simon Kuznets,['Robert W Fogel'],w02461,['Development of the American Economy']
2458,2462,1987,December,The Incidence and Efficiency Costs of Corporate Taxation when Corporate and Noncorporate Firms Produce the Same Good,"['Jane G Gravelle', 'Laurence J Kotlikoff']",w02462,['Public Economics']
2459,2463,1987,December,"Pension Backloading, Wage Taxes, and Work Disincentives","['David A Wise', 'Laurence J Kotlikoff']",w02463,"['Labor Studies', 'Economics of Aging']"
2460,2464,1987,December,The Flexible Exchange Rate System: Experience and Alternatives,"['Jeffrey A Frankel', 'Rudiger Dornbusch']",w02464,"['International Trade and Investment', 'International Finance and Macroeconomics']"
2461,2465,1987,December,Industry Effects and Appropriability Measures in the Stock Markets Valuation of R&D and Patents,"['Iain M Cockburn', 'Zvi Griliches']",w02465,"['Productivity, Innovation, and Entrepreneurship']"
2462,2466,1987,December,The Gains from Fiscal Cooperation in the Two Commodity Real Trade Model,['Stephen J Turnovsky'],w02466,"['International Trade and Investment', 'International Finance and Macroeconomics']"
2463,2467,1987,December,Dynamic Strategic Monetary Policies and Coordination in Interdependent Economies,"['Stephen J Turnovsky', 'Tamer Basar', ""Vasco d'Orey""]",w02467,"['International Trade and Investment', 'International Finance and Macroeconomics']"
2464,2468,1987,December,The Politics of Ambiguity,"['Alberto F Alesina', 'Alex Cukierman']",w02468,['Monetary Economics']
2465,2469,1987,December,"Quits, Moves, Spatial Equilibrium and Workplace Relocation",['Jeffrey S Zax'],w02469,['Labor Studies']
2466,2470,1987,December,A Dynamic Programming Model of Retirement Behavior,['John P Rust'],w02470,['Economics of Aging']
2467,2471,1987,December,"The Dynamics of Housing Demand by the Elderly: Wealth, Cash Flow, and Demographic Effects","['Daniel L McFadden', 'Jonathan S Feinstein']",w02471,['Economics of Aging']
2468,2472,1987,December,The Case of the Negative Nominal Interest Rates: New Estimates of the Term Structure of Interest Rates During the Great Depression,['Stephen G Cecchetti'],w02472,['Monetary Economics']
2469,2473,1987,December,Recent Developments in Macroeocnomics,['Stanley Fischer'],w02473,['Economic Fluctuations and Growth']
2470,2474,1987,December,Recent Developments in Macroeconomics: A Very Quick Refresher Course,['N Gregory Mankiw'],w02474,['Economic Fluctuations and Growth']
2471,2475,1987,December,"Monetary Policy and Performance in the U.S., Japan and Europe, 1973-86",['Stanley Fischer'],w02475,['Economic Fluctuations and Growth']
2472,2476,1987,December,Real Rigidities and the Non-Neutrality of Money,"['David H Romer', 'Laurence M Ball']",w02476,['Economic Fluctuations and Growth']
2473,2477,1987,December,Productivity in American Whaling: The New Bedford Fleet in the Nineteenth Century,"['Lance E Davis', 'Robert E Gallman', 'Teresa Hutchins']",w02477,['Development of the American Economy']
2474,2478,1987,December,"The Taxation of Income from Capital in the United States, 1980-86","['Don Fullterton', 'Marios Karayannis']",w02478,['Public Economics']
2475,2479,1988,January,The U.S. Japan Trade Imbalance from the Japanese Perspective,['Ryuzo Sato'],w02479,['Monetary Economics']
2476,2480,1988,January,Real Business Cycle Models,['Bennett T McCallum'],w02480,"['Monetary Economics', 'Economic Fluctuations and Growth']"
2477,2481,1988,January,Target Zones and Exchange Rate Dynamics,['Paul R Krugman'],w02481,"['International Trade and Investment', 'International Finance and Macroeconomics']"
2478,2482,1988,January,Fiscal Policies and the Dollar/Pound Exchange Rate: 1870-1984,['Vittorio U Grilli'],w02482,"['International Trade and Investment', 'International Finance and Macroeconomics']"
2479,2483,1988,January,Some Empirical Evidence on Hysteresis in Aggregate US Import Prices,['Richard E Baldwin'],w02483,"['International Trade and Investment', 'International Finance and Macroeconomics']"
2480,2484,1988,January,The Basic Analytics of Moral Hazard,"['Joseph E Stiglitz', 'Richard J Arnott']",w02484,['Public Economics']
2481,2485,1988,January,Monopoly Wealth and International Debt,['Jonathan Eaton'],w02485,"['International Trade and Investment', 'International Finance and Macroeconomics']"
2482,2486,1988,January,Financing vs. Forgiving a Debt Overhang,['Paul R Krugman'],w02486,"['International Trade and Investment', 'International Finance and Macroeconomics']"
2483,2487,1988,January,The Implications of Knowledge-Based Growth for the Optimality of Open Capital Markets,"['Meir Kohn', 'Nancy Peregrim Marion']",w02487,"['International Trade and Investment', 'International Finance and Macroeconomics']"
2484,2488,1988,January,Consumer Durables and the Optimality of Usually Doing Nothing,"['Alan S Blinder', 'Avner Bar-Ilan']",w02488,['Economic Fluctuations and Growth']
2485,2489,1988,January,The Challenge of High Unemployment,['Alan S Blinder'],w02489,['Economic Fluctuations and Growth']
2486,2490,1988,January,Does the Consumption of Different Age Groups Move Together? A New Nonparametric Test of Intergenerational Altruism,"['Andrew B Abel', 'Laurence J Kotlikoff']",w02490,"['Economic Fluctuations and Growth', 'Monetary Economics', 'Public Economics']"
2487,2491,1988,January,"The Real Exchange Rate, Employment, and Output in Manufacturing in the U.S. and Japan","['James P Love', 'William H Branson']",w02491,"['International Trade and Investment', 'International Finance and Macroeconomics']"
2488,2492,1988,January,Investment Tax Incentives and Frequent Tax Reforms,"['Alan J Auerbach', 'James R Hines, Jr']",w02492,['Public Economics']
2489,2493,1988,January,Multinational Firms and Manufactured Exports from Developing Countries,"['Irving B Kravis', 'Magnus Blomstrom', 'Robert E Lipsey']",w02493,"['International Trade and Investment', 'International Finance and Macroeconomics']"
2490,2494,1988,January,Financial Market Imperfections and Business Cycles,"['Bruce C Greenwald', 'Joseph E Stiglitz']",w02494,['Monetary Economics']
2491,2495,1988,January,VAR Models as Structural Approximations,['Ray C* Fair'],w02495,['Economic Fluctuations and Growth']
2492,2496,1988,January,Consumption: Beyond Certainty Equivalence,"['N Gregory Mankiw', 'Olivier Jean Blanchard']",w02496,['Economic Fluctuations and Growth']
2493,2497,1988,January,"Firm Heterogeneity, Internal Finance, and `Credit Rationing'","['Charles W Calormiris', 'R Glenn Hubbard']",w02497,['Monetary Economics']
2494,2498,1988,January,International Evidence on the Persistence of Economic Fluctuations,"['John Y Campbell', 'N Gregory Mankiw']",w02498,['Economic Fluctuations and Growth']
2495,2499,1988,January,The Determinants of Queues for Federal Jobs,['Alan B Krueger'],w02499,['Labor Studies']
2496,2500,1988,January,Are Public Sector Workers Paid More Than Their Alternative Wage? Evidence From Longitudinal Data and Job Queues,['Alan B Krueger'],w02500,['Labor Studies']
2497,2501,1988,January,The Baby Boom's Legacy: Relative Wages in the 21st Century,"['Olivia S Mitchell', 'Phillip B Levine']",w02501,['Labor Studies']
2498,2502,1988,February,Structural Adjustment Policies in Highly Indebted Countries,['Sebastian Edwards'],w02502,"['International Trade and Investment', 'International Finance and Macroeconomics']"
2499,2503,1988,February,The Informational Content of Ex Ante Forecasts,"['Ray C* Fair', 'Robert J Shiller']",w02503,['Economic Fluctuations and Growth']
2500,2504,1988,February,The Political Economy of Controls: American Sugar,['Anne O Krueger'],w02504,"['International Trade and Investment', 'International Finance and Macroeconomics']"
2501,2505,1988,February,Obstacles to International Macroeconomic Policy Coordination,['Jeffrey A Frankel'],w02505,"['International Trade and Investment', 'International Finance and Macroeconomics']"
2502,2506,1988,February,The Efficiency of the Market for Single-Family Homes,"['Karl E Case', 'Robert J Shiller']",w02506,['Monetary Economics']
2503,2507,1988,February,Randomization with Asymmetric Information,"['Joseph E Stiglitz', 'Richard J Arnott']",w02507,['']
2504,2508,1988,February,"Deterrence, Work and Crime: Revisiting the Issues with Birth Cohort Data","['Ann Dryden Witte', 'Harriet Griesinger', 'Helen V Tauchen']",w02508,['Labor Studies']
2505,2509,1988,February,Why Do Pensions Reduce Mobility?,"['Ann A McDermed', 'Robert L Clark', 'Steven G Allen']",w02509,['Labor Studies']
2506,2510,1988,February,The Deadweight Loss from `Non-Neutral' Capital Income Taxation,['Alan J Auerbach'],w02510,['Public Economics']
2507,2511,1988,February,"Stock Prices, Earnings and Expected Dividends","['John Y Campbell', 'Robert J Shiller']",w02511,['Monetary Economics']
2508,2512,1988,February,Randomness in Tax Enforcement,"['Joel B Slemrod', 'Suzanne Scotchmer']",w02512,['Public Economics']
2509,2513,1988,February,The Challenge to U.S. Leadership in High-Technology Industries (Can the United States Maintain Its Lead? Should It Try?),['Rachel McCulloch'],w02513,"['International Trade and Investment', 'International Finance and Macroeconomics']"
2510,2514,1988,February,Organized Labor and the Scope of International Specialization,['Robert W Staiger'],w02514,"['International Trade and Investment', 'International Finance and Macroeconomics']"
2511,2515,1988,February,Heckscher-Olin Theory and Non-Competitive Markets,['Robert W Staiger'],w02515,"['International Trade and Investment', 'International Finance and Macroeconomics']"
2512,2516,1988,February,Has State Redistribution Policy Grown More Conservative?,['Robert A Moffitt'],w02516,['Public Economics']
2513,2517,1988,February,The Implications of Insurance for the Efficacy of Fiscal Policy,['Andrew B Abel'],w02517,['Economic Fluctuations and Growth']
2514,2518,1988,February,Rules Versus Discretion in Monetary Policy,['Stanley Fischer'],w02518,"['Economic Fluctuations and Growth', 'Monetary Economics']"
2515,2519,1988,February,Capital Subsidies and Countervailing Duties in Oligopolistic Industries,['Barbara J Spencer'],w02519,"['International Trade and Investment', 'International Finance and Macroeconomics']"
2516,2520,1988,February,The Role of Demand Management in the Maintenance of Full Employment,['Bennett T McCallum'],w02520,"['Economic Fluctuations and Growth', 'Monetary Economics']"
2517,2521,1988,February,Tariffs and Saving in a Model with New Families,"['Charles Engel', 'Kenneth M Kletzer']",w02521,"['International Trade and Investment', 'International Finance and Macroeconomics']"
2518,2522,1988,February,Sectoral Shocks and Structural Unemployment,"['Michael H Riordan', 'Robert W Staiger']",w02522,"['International Trade and Investment', 'International Finance and Macroeconomics']"
2519,2523,1988,February,Some Empirical Evidence on the Production Level and Production Cost Smoothing Models of Inventory Investment,['Martin S Eichenbaum'],w02523,['Economic Fluctuations and Growth']
2520,2524,1988,February,Takeover Bids below the Expected Value of Minority Shares,['Lucian Arye Bebchuk'],w02524,['']
2521,2525,1988,March,"The Poor at Birth: Infant Auxology and Mortality at Philadelphia's Almshouse Hospital, 1848-1873","['Claudia D Goldin', 'Robert A Margo']",w02525,['Development of the American Economy']
2522,2526,1988,March,The Compliance Cost of Itemizing Deductions: Evidence from Individual Tax Returns,"['Joel B Slemrod', 'Mark M Pitt']",w02526,['Public Economics']
2523,2527,1988,March,Optimal Policies with Strategic Distortions,"['Kala Krishna', 'Marie C Thursby']",w02527,"['International Trade and Investment', 'International Finance and Macroeconomics']"
2524,2528,1988,March,Can Public Spending Cuts be Inflationary?,['Willem H Buiter'],w02528,['Monetary Economics']
2525,2529,1988,March,On the Determinants of the Value of Call Options on Default-Free Bonds,"['Anthony B Sanders', 'Patric H Hendershott', 'Stephen A Buser']",w02529,['Monetary Economics']
2526,2530,1988,March,Change in Market Assessments of Deposit-Institution Riskiness,"['Edward J Kane', 'Haluk Unal']",w02530,['Monetary Economics']
2527,2531,1988,March,The Line Item Veto and Public Sector Budgets: Evidence from the States,['Douglas Holtz-Eakin'],w02531,['']
2528,2532,1988,March,Alternative Mechanisms for Corporate Control,"['Andrei Shleifer', 'Randall K Morck', 'Robert W Vishny']",w02532,['Monetary Economics']
2529,2533,1988,March,"Fads, Martingales, and Market Efficiency",['Bruce N Lehmann'],w02533,['Monetary Economics']
2530,2534,1988,March,"Credit, Money, and Aggregate Demand","['Alan S Blinder', 'Ben S Bernanke']",w02534,['Economic Fluctuations and Growth']
2531,2535,1988,March,"An Analysis Of Pension Benefit Formulas, Pension Wealth And Incentives From Pensions","['Alan L Gustman', 'Thomas L Steinmeier']",w02535,['Labor Studies']
2532,2536,1988,March,National Price Levels and the Prices of Tradables and Nontradables,"['Irving B Kravis', 'Robert E Lipsey']",w02536,"['International Trade and Investment', 'International Finance and Macroeconomics']"
2533,2537,1988,March,The Effect Of The Investment Tax Credit On The Value Of The Firm,['Andrew B Lyon'],w02537,['Public Economics']
2534,2538,1988,March,What Moves Stock Prices?,"['David M Cutler', 'James M Poterba', 'Lawrence H Summers']",w02538,"['Monetary Economics', 'Economic Fluctuations and Growth']"
2535,2539,1988,March,"Competitiveness, Realignment, and Speculation: The Role of Financial Markets",['Maurice Obstfeld'],w02539,"['International Trade and Investment', 'International Finance and Macroeconomics']"
2536,2540,1988,May,Product Development and International Trade,"['Elhanan Helpman', 'Gene M Grossman']",w02540,"['International Trade and Investment', 'International Finance and Macroeconomics']"
2537,2541,1988,March,"LDC Debt: Forgiveness, Indexation, and Investment Incentives","['David S Scharfstein', 'Jeremy C Stein', 'Kenneth A Froot']",w02541,"['International Trade and Investment', 'International Finance and Macroeconomics']"
2538,2542,1988,March,Exchange Rate Pass-Through When Market Share Matters,"['Kenneth A Froot', 'Paul D Klemperer']",w02542,"['International Trade and Investment', 'International Finance and Macroeconomics']"
2539,2543,1988,March,Compositional Effects of Government Spending in a Two-Country Two-Sector Production Model,"['Robert W Staiger', 'Steven N Durlauf']",w02543,"['International Trade and Investment', 'International Finance and Macroeconomics']"
2540,2544,1988,March,The Macroeconomics of Exchange-rate and Price-level Interactions: Empirical Evidence for West Germany,['Alberto Giovannini'],w02544,"['International Trade and Investment', 'International Finance and Macroeconomics']"
2541,2545,1988,March,Hysteresis In Import Prices: The Beachhead Effect,['Richard E Baldwin'],w02545,"['International Trade and Investment', 'International Finance and Macroeconomics']"
2542,2546,1988,March,Unemployment Insurance And Unemployment Spells,['Bruce D Meyer'],w02546,['Labor Studies']
2543,2547,1988,March,Learning In Equilibrium Models of Arbitration,['Robert S Gibbons'],w02547,['Labor Studies']
2544,2548,1988,March,Workers' Trust Funds and the Logic of Wage Profiles,"['George A Akerlof', 'Lawrence F Katz']",w02548,['Labor Studies']
2545,2549,1988,April,The Contribution of a Monetary History of the United States: 1867 to 1960 To Monetary History,['Michael D Bordo'],w02549,['Monetary Economics']
2546,2550,1988,April,Strikes and Wages: A Test of a Signalling Model,['David Card'],w02550,['Labor Studies']
2547,2551,1988,April,Lessons On Monetary Policy From The 1980's,['Benjamin M Friedman'],w02551,['Monetary Economics']
2548,2552,1988,April,Monetary Policy Without Quantity Variables,['Benjamin M Friedman'],w02552,['Monetary Economics']
2549,2553,1988,April,The Tax Reform Act Of 1986 And Economic Growth,['Patric H Hendershott'],w02553,['Public Economics']
2550,2554,1988,April,"Interindustry R&D Spillovers, Rates Of Return, and Production In High-Tech Industries","['Jeffrey I Bernstein', 'M Ishaq Nadiri']",w02554,"['Productivity, Innovation, and Entrepreneurship']"
2551,2555,1988,April,Resolving Debt Crises: An Historical Perspective,['Barry J Eichengreen'],w02555,"['International Trade and Investment', 'International Finance and Macroeconomics']"
2552,2556,1988,April,A Structural Equation Model for Tax Compliance and Auditing,"['Ann Dryden Witte', 'Helen V Tauchen', 'Kurt J Beron']",w02556,['Public Economics']
2553,2557,1988,April,On The Difference Between Tax And Spending Policies In Models With Finite Horizons,"['Giampaolo Galli', 'William H Branson']",w02557,"['International Trade and Investment', 'International Finance and Macroeconomics']"
2554,2558,1988,April,"Costs Of Financial Distress, Delayed Calls Of Convertible Bonds, And The Role Of Investment Banks","['Andrei Shleifer', 'Dwight M Jaffee']",w02558,['Monetary Economics']
2555,2559,1988,April,Financial Structure and Aggregate Economic Activity: An Overview,['Mark L Gertler'],w02559,"['Economic Fluctuations and Growth', 'Monetary Economics']"
2556,2560,1988,April,"Labor Market Institutions, Constraints, and Performance",['Richard B Freeman'],w02560,['Labor Studies']
2557,2561,1988,April,Job Queues and Wages: New Evidence on the Minimum Wage and Inter-Industry Wage Structure,"['Alan B Krueger', 'Harry J Holzer', 'Lawrence F Katz']",w02561,['Labor Studies']
2558,2562,1988,April,Evaluating the European View that the US has No Unemployment Problem,['Richard B Freeman'],w02562,['Labor Studies']
2559,2563,1988,April,The Impact Of New Unionization On Wages And Working Conditions: A Longitudinal Study Of Establishments Under NLRB Elections,"['Morris M Kleiner', 'Richard B Freeman']",w02563,['Labor Studies']
2560,2564,1988,April,Is There A Regional Bias in Federal Tax Subsidy Rates for Giving?,"['Charles T Clotfelter', 'Daniel R Feenberg']",w02564,"['Public Economics', 'International Trade and Investment', 'International Finance and Macroeconomics']"
2561,2565,1988,April,Real Exchange Rate Variability under Pegged and Floating Nominal Exchange Rate Systems: An Equilibrium Theory,['Alan C Stockman'],w02565,"['International Trade and Investment', 'International Finance and Macroeconomics']"
2562,2566,1988,April,Immigration And Self-Selection,['George J Borjas'],w02566,['Labor Studies']
2563,2567,1988,April,Inflation And Taxation With Optimizing Governments,"['James M Poterba', 'Julio J Rotemberg']",w02567,"['Economic Fluctuations and Growth', 'Public Economics']"
2564,2568,1988,April,Interpreting Cointegrated Models,"['John Y Campbell', 'Robert J Shiller']",w02568,['Monetary Economics']
2565,2569,1988,April,Pricing Physical Assets Internationally,['Bernard Dumas'],w02569,"['International Trade and Investment', 'International Finance and Macroeconomics']"
2566,2570,1988,April,Rates Of Return On Physical And R&D Capital And Structure Of The Production Process: Cross Section And Time Series Evidence,"['Jeffrey I Bernstein', 'M Ishaq Nadiri']",w02570,"['Productivity, Innovation, and Entrepreneurship']"
2567,2571,1988,April,"Investment, Depreciation, And Capital Utilization","['Jeffrey I Bernstein', 'M Ishaq Nadiri']",w02571,"['Productivity, Innovation, and Entrepreneurship']"
2568,2572,1988,May,Labor Demand and the Structure of Adjustment Costs,['Daniel S Hamermesh'],w02572,['Labor Studies']
2569,2573,1988,May,The Time-Variation of Risk and Return in the Foreign Exchange and Stock Markets,"['Alberto Giovannini', 'Philippe Jorion']",w02573,"['International Trade and Investment', 'International Finance and Macroeconomics']"
2570,2574,1988,May,"Bubbles, Fads, and Stock Price Volatility Tests: A Partial Evaluation",['Kenneth D West'],w02574,['Monetary Economics']
2571,2575,1988,May,The Information in the Term Structure: Some Further Results,['Frederic S Mishkin'],w02575,"['Monetary Economics', 'Economic Fluctuations and Growth']"
2572,2576,1988,April,"A Non-Competitive, Equilibrium Model Of Fluctuations",['Robert E Hall'],w02576,['Economic Fluctuations and Growth']
2573,2577,1988,May,On the Consistency of Short-run and Long-run Exchange Rate Expectations,"['Kenneth A Froot', 'Takatoshi Ito']",w02577,"['International Trade and Investment', 'International Finance and Macroeconomics']"
2574,2578,1988,May,Centre For Labour Economics,['Willem H Buiter'],w02578,['Monetary Economics']
2575,2579,1988,April,Corporate Taxes and Incentives and the Structure of Production: A Selected Survey,"['Jeffrey I Bernstein', 'M Ishaq Nadiri']",w02579,['Public Economics']
2576,2580,1988,April,Consumption and Investment,['Andrew B Abel'],w02580,['Economic Fluctuations and Growth']
2577,2581,1988,May,Interest-Rate Smoothing,['Robert J Barro'],w02581,"['Economic Fluctuations and Growth', 'Monetary Economics']"
2578,2582,1988,May,Debt and Conditionality under Endogenous Terms of Trade Adjustment,"['Eduardo R Borensztein', 'Joshua Aizenman']",w02582,"['International Trade and Investment', 'International Finance and Macroeconomics']"
2579,2583,1988,May,Endogenous Participation in Agricultural Support Programs and Ad Valorem Equivalent Modelling,"['John Whalley', 'Randall M Wigle']",w02583,"['International Trade and Investment', 'International Finance and Macroeconomics']"
2580,2584,1988,May,The Role Of Export Subsisies When Product Quality Is Unknown,"['Kyle Bagwell', 'Robert W Staiger']",w02584,"['International Trade and Investment', 'International Finance and Macroeconomics']"
2581,2585,1988,May,"U.S. Inflation, Labor's Share, and the Natural Rate of Unemployment",['Robert J Gordon'],w02585,['Economic Fluctuations and Growth']
2582,2586,1988,May,"Deindustrialization, Reindustrialization, and the Real Exchange Rate",['Paul R Krugman'],w02586,"['International Trade and Investment', 'International Finance and Macroeconomics']"
2583,2587,1988,May,Market-Based Debt-Reduction Schemes,['Paul R Krugman'],w02587,"['International Trade and Investment', 'International Finance and Macroeconomics']"
2584,2588,1988,May,Government Spending in a Simple Model of Endogenous Growth,['Robert J Barro'],w02588,['Economic Fluctuations and Growth']
2585,2589,1988,May,Sources of Business Cycle Fluctuations,"['Mark W Watson', 'Matthew D Shapiro']",w02589,['Economic Fluctuations and Growth']
2586,2590,1988,May,"Relative Wages, Efficiency Wages, and Keynesian Unemployment",['Lawrence H Summers'],w02590,['Economic Fluctuations and Growth']
2587,2591,1988,May,"Labor Hoarding, Inflexible Prices, and Procyclical Productivity","['Julio J Rotemberg', 'Lawrence H Summers']",w02591,['Economic Fluctuations and Growth']
2588,2592,1988,May,"Growth, Technological Progress, and Trade",['Elhanan Helpman'],w02592,"['International Trade and Investment', 'International Finance and Macroeconomics']"
2589,2593,1988,May,Economic Efficiency in Recent Tax Reform History: Policy Reversals or Consistent Improvements?,"['Don Fullterton', 'James B Mackie']",w02593,['Public Economics']
2590,2594,1988,May,"Unemployment Insurance, Recall Expectations, And Unemployment Outcomes","['Bruce D Meyer', 'Lawrence F Katz']",w02594,['Labor Studies']
2591,2595,1988,May,"Market Structure, Strike Activity, and Union Wage Settlements","['John M Abowd', 'Joseph S Tracy']",w02595,['Labor Studies']
2592,2596,1988,May,External Debt and Macroeconomic Performance in South Korea,"['Susan M Collins', 'Won Am Park']",w02596,"['International Trade and Investment', 'International Finance and Macroeconomics']"
2593,2597,1988,May,Sovereign-debt Renegotiations: A Strategic Analysis,"['Raquel Fernandez', 'Robert W Rosenthal']",w02597,"['International Trade and Investment', 'International Finance and Macroeconomics']"
2594,2598,1988,May,South Korea's Experience With External Debt,['Susan M Collins'],w02598,"['International Trade and Investment', 'International Finance and Macroeconomics']"
2595,2599,1988,May,Inflation and the E M S,['Susan M Collins'],w02599,"['International Trade and Investment', 'International Finance and Macroeconomics']"
