,paper,year,month,title,author,code,prog
3474,3478,1990,October,Political Cycles in OECD Economies,"['Alberto F Alesina', 'Nouriel Roubini']",w03478,"['International Trade and Investment', 'International Finance and Macroeconomics']"
3475,3479,1990,October,Recursive Linear Models of Dynamic Economies,"['Lars Peter Hansen', 'Thomas J Sargent']",w03479,['Economic Fluctuations and Growth']
3476,3480,1990,October,Learning and the Value of the Firm,['Nobuhiro Kiyotaki'],w03480,['Monetary Economics']
3477,3481,1990,October,Asset Returns with Transactions Cost and Uninsured Risk: A Stage III Exercise,"['Mark L Gertler', 'S Rao Aiyagari']",w03481,['Monetary Economics']
3478,3482,1990,October,Search for a Theory of Money,"['Nobuhiro Kiyotaki', 'Randall Wright']",w03482,['Monetary Economics']
3479,3483,1990,October,"Auctions with Endogenous Valuations, The Snowball Effect Revisited",['Kala Krishna'],w03483,"['International Trade and Investment', 'International Finance and Macroeconomics']"
3480,3484,1990,October,The Success of Acquisitions: Evidence From Disvestitures,"['Michael S Weisbach', 'Steven N Kaplan']",w03484,['Monetary Economics']
3481,3485,1990,October,"Trade, Knowledge Spillovers, and Growth","['Elhanan Helpman', 'Gene M Grossman']",w03485,['Economic Fluctuations and Growth']
3482,3486,1990,October,On the Predictive Power of Interest Rates and Interest Rate Spreads,['Ben S Bernanke'],w03486,"['Economic Fluctuations and Growth', 'Monetary Economics']"
3483,3487,1990,October,The Federal Funds Rate and the Channels of Monetary Transnission,['Ben S Bernanke'],w03487,"['Economic Fluctuations and Growth', 'Monetary Economics']"
3484,3488,1990,October,"The Gold Standard, Deflation, and Financial Crisis in the Great Depression: An International Comparison","['Ben S Bernanke', 'Harold James']",w03488,"['Economic Fluctuations and Growth', 'Monetary Economics']"
3485,3489,1990,October,"Fiscal Policy, Capital Accumulation, and Debt in an Open Economy","['Partha Sen', 'Stephen J Turnovsky']",w03489,"['International Trade and Investment', 'International Finance and Macroeconomics']"
3486,3490,1990,October,On the Accuracy of Producer Price Indexes for Pharmaceutical Preparations: An Audit Based on Detailed Firm-Specific Data,"['Ernst R Berndt', 'Joshua G Rosett', 'Zvi Griliches']",w03490,"['Productivity, Innovation, and Entrepreneurship']"
3487,3491,1990,October,Sectoral Shifts and Cyclical Unemployment Reconsidered,"['David M Cutler', 'S Lael Brainard']",w03491,['Labor Studies']
3488,3492,1990,October,The Effect of Veterans Benefits on Veterans' Education and Earnings,['Joshua D Angrist'],w03492,['Labor Studies']
3489,3493,1990,October,Explaining Fiscal Policies and Inflation in Developing Countries,"['Guido Tabellini', 'Sebastian Edwards']",w03493,"['International Trade and Investment', 'International Finance and Macroeconomics']"
3490,3494,1990,October,Workers' Compensation and Injury Duration: Evidence from a Natural Experiment,"['Bruce D Meyer', 'David L Durbin', 'W Kip Viscusi']",w03494,['Labor Studies']
3491,3495,1990,October,"Interest Rate Spreads, Credit Constraints, and Investment Fluctuations: An Empirical Investigation","['Anil K Kashyap', 'Mark L Gertler', 'R Glenn Hubbard']",w03495,"['Economic Fluctuations and Growth', 'Monetary Economics']"
3492,3496,1990,October,The Globalization of Information and Capital Mobility,"['Dwight M Jaffee', 'William H Branson']",w03496,"['International Trade and Investment', 'International Finance and Macroeconomics']"
3493,3497,1990,October,"Capital Flows, Foreign Direct Investment, and Debt-Equity Swaps in Developing Countries",['Sebastian Edwards'],w03497,"['International Trade and Investment', 'International Finance and Macroeconomics']"
3494,3498,1990,October,New Trading Practices and Short-run Market Efficiency,"['Andre F Perold', 'Kenneth A Froot']",w03498,['Monetary Economics']
3495,3499,1990,October,International Impacts on Domestic Political Economy: A Case of Japanese General Elections,['Takatoshi Ito'],w03499,['Monetary Economics']
3496,3500,1990,October,"Taxes, Tariffs, and The Global Corporation","['James A Levinsohn', 'Joel B Slemrod']",w03500,['Public Economics']
3497,3501,1990,October,"Taxation and the Cost of Capital: The ""Old"" View, the ""New"" View and Another View",['Hans-Werner Sinn'],w03501,['Public Economics']
3498,3502,1990,October,Efficient Contracting and Market Power: Evidence from the U.S. Natural Gas Industry,"['R Glenn Hubbard', 'Robert J Weiner']",w03502,"['Productivity, Innovation, and Entrepreneurship']"
3499,3503,1990,October,Procyclical Labor Productivity and Competing Theories of the Business Cycle: Some Evidence from Interwar U.S. Manufacturing Industries,"['Ben S Bernanke', 'Martin L Parkinson']",w03503,['Economic Fluctuations and Growth']
3500,3504,1990,October,Where Does the Meteor Shower Come From? The Role of Stochastic Policy Coordination,"['Robert F Engle', 'Takatoshi Ito', 'Wen-Ling Lin']",w03504,"['Monetary Economics', 'International Trade and Investment', 'International Finance and Macroeconomics']"
3501,3505,1990,November,"A General Equilibrium Model of Housing, Taxes, and Portfolio Choice","['Don Fullterton', 'James Berkovec']",w03505,['Public Economics']
3502,3506,1990,November,Distortionary Taxes and the Provision of Public Goods,"['Charles L Ballard', 'Don Fullterton']",w03506,['Public Economics']
3503,3507,1990,November,"Inputs to Tax Policymaking: The Supply Side, the Deficit, and the Level Playing Field",['Don Fullterton'],w03507,['Public Economics']
3504,3508,1990,November,Public Sector Dynamics,['Alan J Auerbach'],w03508,['Public Economics']
3505,3509,1990,November,Immigration and the Family,"['George J Borjas', 'Stephen G Bronars']",w03509,['Labor Studies']
3506,3510,1990,November,Recursive and Sequential Tests of the Unit Root and Trend Break Hypothesis: Theory and International Evidence,"['Anindya Banerjee', 'James H Stock', 'Robin L Lumsdaine']",w03510,['Economic Fluctuations and Growth']
3507,3511,1990,November,Riding the Yield Curve: Reprise,"['Alan J Marcus', 'Robin Grieves']",w03511,['Monetary Economics']
3508,3512,1990,November,"Comparative Advantage, Geographic Advantage, and the Volume of Trade",['James E Rauch'],w03512,"['International Trade and Investment', 'International Finance and Macroeconomics']"
3509,3513,1990,November,A Simple Model of Useless Speculation,"['Hans-Werner Sinn', 'Murray C Kemp']",w03513,"['International Trade and Investment', 'International Finance and Macroeconomics']"
3510,3514,1990,November,The Draft Lottery and Voluntary Enlistment in the Vietnam Era,['Joshua D Angrist'],w03514,['Labor Studies']
3511,3515,1990,November,Equipment Investment and Economic Growth,"['J Bradford De Long', 'Lawrence H Summers']",w03515,['Economic Fluctuations and Growth']
3512,3516,1990,November,Municipal Labor Demand in the Presence of Uncertainty: An Econometric Approach,"['Douglas Holtz-Eakin', 'Harvey S Rosen']",w03516,['Public Economics']
3513,3517,1990,November,British and French Finance During the Napoleonic Wars,"['Eugene N White', 'Michael D Bordo']",w03517,"['Economics of Aging', 'Monetary Economics']"
3514,3518,1990,November,High Inflation and the Nominal Anchors of an Open Economy,['Michael Bruno'],w03518,"['International Trade and Investment', 'International Finance and Macroeconomics']"
3515,3519,1990,November,Taxation and the Birth of Foreign Subsidiaries,['Hans-Werner Sinn'],w03519,['Public Economics']
3516,3520,1990,November,"Stock Prices, News, and Business Conditions","['Grant McQueen', 'V Vance Roley']",w03520,['Monetary Economics']
3517,3521,1990,November,Post-War Economic Growth in the Group-of-Five Countries: A New Analysis,"['Lawrence J Lau', 'Michael J Boskin']",w03521,['Economic Fluctuations and Growth']
3518,3522,1990,November,The Economics of Seasonal Cycles,['Jeffrey A Miron'],w03522,['Economic Fluctuations and Growth']
3519,3523,1990,November,The Bubble of 1929: Evidence from Closed-End Funds,"['Andrei Shleifer', 'J Bradford De Long']",w03523,['Monetary Economics']
3520,3524,1990,December,Job Vacancy Rates in the Firm: An Empirical Analysis,['Harry J Holzer'],w03524,['Labor Studies']
3521,3525,1990,December,Pension Portability and Labor Mobility: Evidence From the Survey of Income and Program Participation,"['Alan L Gustman', 'Thomas L Steinmeier']",w03525,['Labor Studies']
3522,3526,1990,December,Hysteresis in the Trade Pattern,"['Elhanan Helpman', 'Gene M Grossman']",w03526,"['International Trade and Investment', 'International Finance and Macroeconomics']"
3523,3527,1990,December,The Benefits of Crises for Economic Reforms,"['Allan Drazen', 'Vittorio U Grilli']",w03527,"['International Trade and Investment', 'International Finance and Macroeconomics']"
3524,3528,1990,December,Economic Integration and Endogenous Growth,"['Luis A Rivera-Batiz', 'Paul M Romer']",w03528,"['Economic Fluctuations and Growth', 'International Trade and Investment', 'International Finance and Macroeconomics']"
3525,3529,1990,December,Time-Consistent Policy and Persistent Changes in Inflation,['Laurence M Ball'],w03529,"['Economic Fluctuations and Growth', 'Monetary Economics']"
3526,3530,1990,December,The Allocation of Talent: Implications for Growth,"['Andrei Shleifer', 'Kevin M Murphy', 'Robert W Vishny']",w03530,['Economic Fluctuations and Growth']
3527,3531,1990,December,"Tax Policy, Investments in Human and Physical Capital, and Productivity","['Assaf Razin', 'Effraim Sadka', 'Marc Nerlove', 'Robert K von Weizsacker']",w03531,['Public Economics']
3528,3532,1990,December,American Economic Policy and the International Debt Crisis,['Hans-Werner Sinn'],w03532,['Public Economics']
3529,3533,1990,December,Macroeconomic Models with Equity and Credit Rationing,"['Bruce C Greenwald', 'Joseph E Stiglitz']",w03533,['Economic Fluctuations and Growth']
3530,3534,1990,December,Cyclical Markups: Theories and Evidence,"['Julio J Rotemberg', 'Michael Woodford']",w03534,['Economic Fluctuations and Growth']
3531,3535,1990,December,The Effect of Illicit Drug Use on the Wages of Young Adults,['Robert Kaestner'],w03535,['Health Economics']
3532,3536,1990,December,Maternal Labor Supply and Children's Cognitive Development,"['Adam J Grossberg', 'Francine D Blau']",w03536,['Labor Studies']
3533,3537,1990,December,Why Are There So Few Black Entrepreneurs?,['Bruce D Meyer'],w03537,['Labor Studies']
3534,3538,1990,December,The Transfer Pricing Problem: Where the Profits Are,"['James R Hines, Jr']",w03538,['Public Economics']
3535,3539,1990,December,The Making of Exchange Rate Policy in the 1980s,['Jeffrey A Frankel'],w03539,"['International Trade and Investment', 'International Finance and Macroeconomics']"
3536,3540,1990,December,Basic Concepts of International Taxation,"['Assaf Razin', 'Effraim Sadka', 'Jacob A Frenkel']",w03540,"['International Trade and Investment', 'International Finance and Macroeconomics']"
3537,3541,1990,December,A Contribution to the Empirics of Economic Growth,"['David H Romer', 'David N Weil', 'N Gregory Mankiw']",w03541,['Economic Fluctuations and Growth']
3538,3542,1990,December,Contracts and the Market for Executives,['Sherwin Rosen'],w03542,['Labor Studies']
3539,3543,1990,December,An Empirical Exploration of Exchange Rate Target-Zones,"['Andrew K Rose', 'Donald J Mathieson', 'Robert P Flood']",w03543,"['International Trade and Investment', 'International Finance and Macroeconomics']"
3540,3544,1990,December,The Political Economy of American Protection in Theory and in Practice,['Anne O Krueger'],w03544,"['International Trade and Investment', 'International Finance and Macroeconomics']"
3541,3545,1990,December,Impact of Government on Growth and Trade,"['Anne O Krueger', 'David Orsmond']",w03545,['Economic Fluctuations and Growth']
3542,3546,1990,December,"""Liquidation"" Cycles: Old-Fashioned Real Business Cycle Theory and the Great Depression",['J Bradford De Long'],w03546,['Monetary Economics']
3543,3547,1990,December,Aging and the Income Value of Housing Wealth,"['David A Wise', 'Steven F Venti']",w03547,['Economics of Aging']
3544,3548,1990,December,The Market for Home Mortgage Credit: Recent Changes and Future Prospects,['Patric H Hendershott'],w03548,['Monetary Economics']
3545,3549,1990,December,"Self-Selection, Prenatal Care, and Birthweight Among Blacks, Whites and Hispanics in New York City",['Theodore J Joyce'],w03549,['Health Economics']
3546,3550,1990,December,Yield Curve,['Frederic S Mishkin'],w03550,['Monetary Economics']
3547,3551,1990,December,Banks and Loan Sales: Marketing Non-Marketable Assets,"['Gary B Gorton', 'George G Pennacchi']",w03551,['Monetary Economics']
3548,3552,1990,December,The Aggregate Implications of Machine Replacement: Theory and Evidence,"['John C Haltiwanger', 'Russell W Cooper']",w03552,['Economic Fluctuations and Growth']
3549,3553,1990,December,Last One Out Wins: Trade Policy in an International Exit Game,['S Lael Brainard'],w03553,"['International Trade and Investment', 'International Finance and Macroeconomics']"
3550,3554,1990,December,Public Goods in Trade: On the Formation of Markets and Political Jurisdictions,"['Alessandra Casella', 'Jonathan S Feinstein']",w03554,"['International Trade and Investment', 'International Finance and Macroeconomics']"
3551,3555,1990,December,Credible Disinflation with Staggered Price Setting,['Laurence M Ball'],w03555,['Economic Fluctuations and Growth']
3552,3556,1990,December,Labor Hoarding and the Business Cycle,"['A Craig Burnside', 'Martin S Eichenbaum', 'Sergio T Rebelo']",w03556,['Economic Fluctuations and Growth']
3553,3557,1990,December,The Incidence of Mandated Employer-Provided Insurance: Lessons from Workers' Compensation Insurance,"['Alan B Krueger', 'Jonathan Gruber']",w03557,"['Labor Studies', 'Public Economics']"
3554,3558,1990,December,Three Models of Retirement: Computational Complexity Versus Predictive Validity,"['David A Wise', 'James H Stock', 'Robin L Lumsdaine']",w03558,['Economics of Aging']
3555,3559,1990,December,Approaches to Efficient Capital Taxation: Leveling the Playing Field vs.Living by the Golden Rule,"['Lawrence H Goulder', 'Philippe Thalmann']",w03559,['Public Economics']
3556,3560,1990,December,Individual Precautions to Prevent Theft: Private Versus Socially Optimal Behavior,['Steven Shavell'],w03560,['Law and Economics']
3557,3561,1990,December,"Soft Budget Constraints, Taxes, and the Incentive to Cooperate",['Joshua Aizenman'],w03561,"['International Trade and Investment', 'International Finance and Macroeconomics']"
3558,3562,1990,December,What has Foreign Market Intervention Since the Plaza Agreement Accomplished?,"['Anna J Schwartz', 'Michael D Bordo']",w03562,"['Monetary Economics', 'International Trade and Investment', 'International Finance and Macroeconomics']"
3559,3563,1990,December,Lecture Notes on Economic Growth(I): Introduction to the Literature and Neoclassical Models,['Xavier X Sala-i-Martin'],w03563,['Economic Fluctuations and Growth']
3560,3564,1990,December,Lecture Notes on Economic Growth(II): Five Prototype Models of Endogenous Growth,['Xavier X Sala-i-Martin'],w03564,['Economic Fluctuations and Growth']
3561,3565,1990,December,A Signaling Theory of Unemployment,"['Andrew M Weiss', 'Ching-to Albert Ma']",w03565,['Labor Studies']
3562,3566,1990,December,Tastes and Technology in a Two-Country Model of the Business Cycle: Explaining International Comovements,"['Alan C Stockman', 'Linda L Tesar']",w03566,"['International Trade and Investment', 'International Finance and Macroeconomics']"
3563,3567,1990,December,Quality Adjusted Cost Functions,"['Donald M Waldman', 'Paul J Gertler']",w03567,['Health Economics']
3564,3568,1990,December,A Micro Econometric Model of Capital Utilization and Retirement,['Sanghamitra Das'],w03568,"['Productivity, Innovation, and Entrepreneurship']"
3565,3569,1990,December,Theory and Practice of Commercial Policy: 1945-1990,['Anne O Krueger'],w03569,"['International Trade and Investment', 'International Finance and Macroeconomics']"
3566,3570,1990,December,Exchange Rate Volatility in Integrating Capital Markets,"['Giancarlo Corsetti', 'Nouriel Roubini', 'Vittorio U Grilli']",w03570,"['International Trade and Investment', 'International Finance and Macroeconomics']"
3567,3571,1990,December,The Effect of Age at School Entry on Educational Attainment: An Application of Instrumental Variables with Moments from Two Samples,"['Alan B Krueger', 'Joshua D Angrist']",w03571,['Labor Studies']
3568,3572,1990,December,Does Compulsory School Attendance Affect Schooling and Earnings?,"['Alan B Krueger', 'Joshua D Angrist']",w03572,['Labor Studies']
3569,3573,1990,December,The Assimilation of Immigrants in the U.S. Labor Markets,"['Robert H Topel', 'Robert J LaLonde']",w03573,['Labor Studies']
3570,3574,1991,January,A Multi-Country Comparison of Term Structure Forecasts at Long Horizons,"['Frederic S Mishkin', 'Philippe Jorion']",w03574,['Monetary Economics']
3571,3575,1991,January,National Origin and the Skills of Immigrants in the Postwar Period,['George J Borjas'],w03575,['Labor Studies']
3572,3576,1991,January,Stochastic Devaluation Risk and the Empirical Fit of Target Zone Models,"['Giuseppe Bertola', 'Lars E O Svensson']",w03576,"['International Trade and Investment', 'International Finance and Macroeconomics']"
3573,3577,1991,January,Learning by Doing and the Dynamic Effects of International Trade,['Alwyn Young'],w03577,['Economic Fluctuations and Growth']
3574,3578,1991,January,Is the Gasoline Tax Regressive?,['James M Poterba'],w03578,['Public Economics']
3575,3579,1991,January,Is Europe an Optimum Currency Area?,['Barry J Eichengreen'],w03579,"['International Trade and Investment', 'International Finance and Macroeconomics']"
3576,3580,1991,January,Methodological Issues and the New Keynesian Economics,['Joseph E Stiglitz'],w03580,['Economic Fluctuations and Growth']
3577,3581,1991,January,"Human Capital, Technology, and the Wage Structure: What Do Time Series Show?",['Jacob Mincer'],w03581,['Labor Studies']
3578,3582,1991,January,Assessing the Productivity of Information Technology Equipment in U.S. Manufacturing Industries,"['Catherine J Morrison', 'Ernst R Berndt']",w03582,"['Productivity, Innovation, and Entrepreneurship']"
3579,3583,1991,January,Should the Holding Period Matter for the Intertemporal Consumption-Based CAPM?,['Karen K Lewis'],w03583,['Monetary Economics']
3580,3584,1991,January,"Price-Cost Margins, Exports and Productivity Growth: With an Application to Canadian Industries","['Jeffrey I Bernstein', 'Pierre A Mohnen']",w03584,"['Productivity, Innovation, and Entrepreneurship']"
3581,3585,1991,January,From Inertia to Megainflation: Brazil in the 1980s,['Eliana A Cardoso'],w03585,"['International Trade and Investment', 'International Finance and Macroeconomics']"
3582,3586,1991,January,Precautionary Motives for Holding Assets,['Miles S Kimball'],w03586,['Monetary Economics']
3583,3587,1991,January,Employer Size and Dual Labor Markets,"['James B Rebitzer', 'Michael D Robinson']",w03587,['Labor Studies']
3584,3588,1991,January,Equilibrium in Competitive Insurance Markets with Moral Hazard,"['Joseph E Stiglitz', 'Richard J Arnott']",w03588,['Monetary Economics']
3585,3589,1991,January,Generational Accounts - A Meaningful Alternative to Deficit Accounting,"['Alan J Auerbach', 'Jagadeesh Gokhale', 'Laurence J Kotlikoff']",w03589,"['Economic Fluctuations and Growth', 'Public Economics', 'Economic Fluctuations and Growth', 'Economics of Aging']"
3586,3590,1991,January,International Accounting Diversity: Does it Impact Market Participants?,"['Frederick D S Choi', 'Richard M Levich']",w03590,"['International Trade and Investment', 'International Finance and Macroeconomics']"
3587,3591,1991,January,Volatility Tests and Efficient Markets: A Review Essay,['John H Cochrane'],w03591,"['Economic Fluctuations and Growth', 'Monetary Economics']"
3588,3592,1991,January,The Changing Fortunes of FHA's Mutual Mortgage Insurance Fund and the Legislative Response,"['James A Waddell', 'Patric H Hendershott']",w03592,['Monetary Economics']
3589,3593,1991,January,The Effects of Pensions and Retirement Policies on Retirement in Higher Education,"['Alan L Gustman', 'Thomas L Steinmeier']",w03593,"['Economics of Aging', 'Labor Studies']"
3590,3594,1991,January,International Trade with Endogenous Technological Change,"['Luis A Rivera-Batiz', 'Paul M Romer']",w03594,"['Economic Fluctuations and Growth', 'International Trade and Investment', 'Economic Fluctuations and Growth', 'International Finance and Macroeconomics']"
3591,3595,1991,January,"Money, Interest and Prices",['Stanley Fischer'],w03595,['Economic Fluctuations and Growth']
3592,3596,1991,January,Macroeconomic Aspects of German Unification,['Hans-Werner Sinn'],w03596,['']
3593,3597,1991,January,Alexander Hamilton's Market Based Debt Reduction Plan,['Peter M Garber'],w03597,"['Monetary Economics', 'International Trade and Investment', 'International Finance and Macroeconomics']"
3594,3598,1991,January,How Regional Differences in Taxes and Public Goods Distort Life Cycle Location Choices,"['Bernd Raffelhueschen', 'Laurence J Kotlikoff']",w03598,['Public Economics']
3595,3599,1991,January,Is Inequality Harmful for Growth? Theory and Evidence,"['Guido Tabellini', 'Torsten Persson']",w03599,"['Monetary Economics', 'Economic Fluctuations and Growth', 'International Trade and Investment', 'International Finance and Macroeconomics']"
3596,3600,1991,January,"Trade Reforms, Credibility, and Development",['Joshua Aizenman'],w03600,"['International Trade and Investment', 'International Finance and Macroeconomics']"
3597,3601,1991,January,Target Zones Big and Small,"['Bernard Dumas', 'Francisco Delgado']",w03601,"['International Trade and Investment', 'International Finance and Macroeconomics']"
3598,3602,1991,January,Intertemporal Labor Supply: An Assessment,['David Card'],w03602,['Labor Studies']
3599,3603,1991,January,Destabilizing Effects of Exchange-Rate Escape Clauses,['Maurice Obstfeld'],w03603,"['International Trade and Investment', 'International Finance and Macroeconomics']"
3600,3604,1991,January,Government Revenue from Financial Repression,"['Alberto Giovannini', 'Martha de Melo']",w03604,"['Public Economics', 'International Trade and Investment', 'Monetary Economics', 'International Finance and Macroeconomics']"
3601,3605,1991,January,Reconciling the Pattern of Trade with the Pattern of Migration,['James E Rauch'],w03605,"['International Trade and Investment', 'Labor Studies', 'International Finance and Macroeconomics']"
3602,3606,1991,January,"Agricultural Productivity, Comparative Advantage and Economic Growth",['Kiminori Matsuyama'],w03606,['Economic Fluctuations and Growth']
3603,3607,1991,January,Cities in Space: Three Simple Models,['Paul R Krugman'],w03607,"['International Trade and Investment', 'International Finance and Macroeconomics']"
3604,3608,1991,January,The Fertility of Immigrant Women: Evidence from High Fertility Source Countries,['Francine D Blau'],w03608,['Labor Studies']
3605,3609,1991,January,Investor Diversification and International Equity Markets,"['James M Poterba', 'Kenneth R French']",w03609,['Monetary Economics']
3606,3610,1991,February,New Goods and Index Numbers: U.S. Import Prices,['Robert C Feenstra'],w03610,"['International Trade and Investment', 'Productivity, Innovation, and Entrepreneurship', 'International Finance and Macroeconomics']"
3607,3611,1991,February,A Model of the Political Economy of the United States,"['Alberto F Alesina', 'Howard L Rosenthal', 'John Londregan']",w03611,['']
3608,3612,1991,February,Was there a bubble in the 1929 Stock Market?,"['Eugene N White', 'Peter Rappoport']",w03612,['Monetary Economics']
3609,3613,1991,February,Speculative Behavior in the Stock Markets: Evidence from the United States and Japan,"['Fumiko Kon-Ya', 'Robert J Shiller', 'Yoshiro Tsutsui']",w03613,['Monetary Economics']
3610,3614,1991,February,Internal Currency Markets and Production in the Soviet Union,"[""Il'dar Karimov"", 'Linda S Goldberg']",w03614,"['International Trade and Investment', 'International Finance and Macroeconomics']"
3611,3615,1991,February,Host Country Benefits of Foreign Investment,['Magnus Blomstrom'],w03615,"['International Trade and Investment', 'International Finance and Macroeconomics']"
3612,3616,1991,February,Capital Formation in Latin America,['Eliana A Cardoso'],w03616,"['International Trade and Investment', 'International Finance and Macroeconomics']"
3613,3617,1991,February,Window Dressing by Pension Fund Managers,"['Andrei Shleifer', 'Josef Lakonishok', 'Richard H Thaler', 'Robert W Vishny']",w03617,['Monetary Economics']
3614,3618,1991,February,Asset Sales and Debt Capacity,"['Andrei Shleifer', 'Robert W Vishny']",w03618,['Monetary Economics']
3615,3619,1991,February,Tax Policy and Business Fixed Investment in the United States,"['Alan J Auerbach', 'Kevin A Hassett']",w03619,['Public Economics']
3616,3620,1991,February,Reducing the Risk of Economic Crisis,['Martin S Feldstein'],w03620,['Monetary Economics']
3617,3621,1991,February,The Genesis of Inflation and the Costs of Disinflation,['Laurence M Ball'],w03621,['Economic Fluctuations and Growth']
3618,3622,1991,February,Quality and Trade,"['Andrei Shleifer', 'Kevin M Murphy']",w03622,"['International Trade and Investment', 'International Finance and Macroeconomics']"
3619,3623,1991,February,Foreign Direct Investment in the U.S. and U.S. Trade,['Robert E Lipsey'],w03623,"['International Trade and Investment', 'International Finance and Macroeconomics']"
3620,3624,1991,February,Updated Estimates of the Impact of Prenatal Care on Birthweight Outcomes by Race,"['Catherine A Jackson', 'David S Salkever', 'Donna Strobino', 'Richard G Frank']",w03624,['Health Economics']
